Song Title,Hymnal Number,Majesty Hymns,Key
"""Are Ye Able,"" Said the Master",354,No,Ab
'Tis so Sweet to Trust in Jesus,,No,
"10,000 Reasons",,No,G
"My Country, Tis of Thee",571,No,
A Child of the King,352,No,Eb
A Christian's Daily Prayer,,No,
A Hymn for the Wilderness,,No,
A Mighty Fortress is Our God,26,No,C
A New Name in Glory,345,Yes,Bb
A Shelter in the Time of Storm,353,No,
A Triune Prayer,,No,
Abide With Me,419,No,Eb
Adore,,No,
Alas! By Nature How Depraved,,No,G
"Alas, and Did my Savior Bleed",208,No,G
All Creatures of Our God and King,64,No,Eb
All Glory be to Christ,,No,Eb
All Hail King Jesus,,No,F
All Hail the Glorious Christ,,No,
All Hail the Lamb,,No,G
All Hail the Power of Jesus' Name,97,No,G
All I Have is Christ,,No,
All People That on Earth Do Dwell,20,No,
All Praise to Him,,No,
"All Praise to You, Eternal Lord",,No,
All That Thrills my Soul,526,No,Bb
All We Need,,No,
All Your Anxiety,418,No,Eb
All in All,,No,F
All in Christ,,No,
All the Way my Savior Leads Me,460,No,G
Alleluia! Sing to Jesus,233,No,
"Alleluia, Alleluia",,No,
Always the Same,182,Yes,C
Am I a Soldier of the Cross?,482,No,F
Amazing Grace,202,No,G
Ancient of Days,,No,
"And, Can It Be?",203,No,G
Angels We Have Heard on High,132,No,
"Angels, From the Realms of Glory",131,No,Bb
Are You Washed in the Blood of the Lamb?,190,No,Ab
"Arise, My Soul, Arise",199,No,Ab
As Long as You Are Glorified,,No,
As Simply as a Child,,No,
As the Deer,,No,G
At Calvary,338,No,
At the Cross,188,No,Eb
At the Name of Jesus,,No,F
Away in a Manger,157,No,
B-I-B-L-E,,No,
Battle Hymn of the Republic,569,No,
Be Exalted,5,No,Bb
"Be Still, My Soul",347,No,F
Be Thou My Vision,382,No,Eb
Beatitudes Hymn,,No,
Because He Lives,213,No,Ab
Before Our Father's Throne,,No,
Before the Cross,,No,
Before the Skies,,No,
Before the Starry Universe,,No,
Before the Throne of God Above,,No,
Behold Our God,,No,C
"Behold, What Manner of Love",,No,Eb
Higher Ground,399,No,
Beneath the Cross of Jesus,183,No,Db
Beyond Imagination,,No,
Blessed Assurance,345,No,D
Blessed be the God of Israel,,No,
Blessed be the Name,103,No,Ab
Blessed be the Tie That Binds,286,No,
Break Thou the Bread of Life,274,No,
"Breathe on Me, Breath of God",259,No,F
"Brethren, We Have Met to Worship",585,No,
Bring Back the Springtime,396,No,Bb
By Our Love,,No,
Whiter Than Snow,436,No,
"Change my Heart, O God",,No,Bb
"O, How I Love Jesus",529,No,G
Christ Arose,216,No,
Christ Crucified,,No,
Christ Exalted is Our Song,,No,
"Christ Jesus, thy Beloved Son",,No,
Christ Receiveth Sinful Men,210,No,D
Christ Will be my Hideaway,,No,
Christ is Coming! Lift Your Eyes!,,No,
"Christ is Risen, He's Risen Indeed",,No,
Christ the Lord is Risen Today,217,No,
"Christ, the Sure and Steady Anchor",,No,
Clap Your Hands,,No,
Cleanse Me,438,No,F
Cling to Christ,,No,
Come and Dine,,No,C
Come to You,,No,
"Come, Bless the Lord",632,Yes,F
"Come, Christians, Join to Sing",108,No,
"Come, Let Us Worship and Bow Down",14,No,
"Come, Lord Jesus",,No,
"Come, People of the Risen King",,No,G
"Come, Thou Almighty King",267,No,F
"Come, Thou Fount of Every Blessing",2,No,D
"Come, Thou Long-Expected Jesus",124,No,G
"Come, We That Love the Lord",18,No,F
"Come, Ye Sinners, Poor and Needy",334,No,Fm
"Come, Ye Thankful People, Come",559,No,F
Commit thy Way Unto the Lord,,No,
Crown Him With Many Crowns,234,No,D
Crucifixion Hymn,,No,
Day by Day,56,No,Eb
Dedication Hymn,,No,
Discover Jesus Christ,,No,
Do Not Fear,,No,
Do Right,,No,
Does Jesus Care?,491,Yes,
Doxology,625,No,G
Draw Near Through Christ,,No,D
Each Moment by Faith,,No,
Emmanuel,134,No,C
"Eternal Father, Strong to Save",575,No,
Ever Full and Overflowing,,No,
Ever Standing in Your Presence,,No,
Every Day With Jesus,,No,
Every Knee Shall Bow to Thee,,No,
Face to Face,549,No,A
Fairest Lord Jesus,,No,
Faith is the Victory,486,No,Eb
Faith of Our Fathers,279,No,
Family of God,282,No,
Far Above Riches,,No,
"Father, I Adore You",265,No,
"Father, I've Failed You",,No,
"Father, Speak Your Word Again",,No,
Fearfully and Wonderfully Made,,No,
"Fill my Cup, Lord",398,No,Bb
Footsteps of Jesus,470,No,Eb
For God so Loved the World,,No,
For Me to Live is Christ,613,No,Eb
For the Beauty of the Earth,560,No,
Forever,,No,
Forgiven,,No,
Freedom Hymn,,No,
"Freely, Freely",447,No,Eb
Fruitful in You,,No,Ab
Give Me Jesus,443,No,Bb
Give Thanks,,No,
Give to Our God Immortal Praise,,No,
Gladly Would I Leave Behind Me,,No,
Glorify Your Name,633,Yes,Bb
Glorify Thy Name,29,No,Bb
Glorious Things of Thee Are Spoken,278,No,
Glorious,,No,
Glory to His Name,527,No,Ab
"Go, Tell It on the Mountain",138,No,
God Alone,,No,
God Has Spoken by the Prophets,,No,D
God Leads Us Along,46,No,Db
God Made Low,,No,
God Rest Ye Merry Gentlemen,,No,
God Supreme,,No,F
God Will Take Care of You,47,No,Bb
God is Light,,No,
God is Our Strength and Refuge,,No,
God is With Us! Alleluia!,,No,
God is so Good,41,No,Eb
God is so Wonderful,,No,
God My Father,,No,
God of Grace and God of Glory,292,No,
God of Our Fathers,573,No,Eb
God of the Ages,568,No,
God's Mysterious Ways,397,No,Ab
"God, Our Father, We Adore Thee",268,No,Bb
"Good Christian Men, Rejoice",151,No,F
Grace Greater Than Our Sin,201,No,
Grace and Peace,,No,
Grace | CityAlight,,No,
Great Lord of All Reality,,No,
Great is the Lord,31,No,C
Great is thy Faithfulness,43,No,D
Greater is He That is in Me,,No,
"Guide Me, O Thou Great Jehovah",51,No,G
"Hallelu, Hallelu",,No,
Hallelujah Hymn,,No,
"Hallelujah, What a Savior!",175,No,Bb
Happy the Home When God is There,,No,
Hark! the Herald Angels Sing!,133,No,
"Have Thine Own Way, Lord",371,No,
He Giveth More Grace,415,No,Eb
He Has Made Me Glad,,No,
He Hideth my Soul,496,No,Db
He Keeps Me Singing,488,No,
He Leadeth Me,461,No,
He Lifted Me,522,No,
He Lives,220,No,Bb
He Looked Beyond my Fault,,No,
He Owns the Cattle on a Thousand Hills,,No,
He Who is Mighty,,No,
He Will Keep You,,No,
He is Able,591,No,F
He is Able to Deliver Thee,310,No,Bb
He is Exalted,,No,E
He is King,33,Yes,F
He is Lord,105,No,G
He is Our God,,No,
He the Pearly Gates Will Open,541,No,
He's Everything to Me,516,No,Bb
Heaven Came Down,495,No,F
Heaven Has Come,,No,
Heavens Shout God's Matchless Glory,,No,
"Here Am I, Lord",,No,
"Here at Your Feet, Lord",,No,
Here's my Heart,,No,
Hiding in Thee,,No,Eb
Higher Ground,399,No,G
His Banner Over Me is Love,,No,
His Name Shall be Praised,,No,
His Name is Wonderful,101,No,F
His Robes for Mine,,No,D
His Way With Thee,333,No,
Hold the Fort,,No,
Holy in Me,,No,
"Holy, Holy, Holy",262,No,D
"Holy, Mighty, Worthy",,No,Ab
How Can It Be?,,No,
How Deep the Father's Love for Us,,No,G
How Firm a Foundation,275,No,Ab
How Great Thou Art,4,No,Bb
How Long Has It Been?,,No,Ab
"How Long, O Lord",,No,
"How Long, O Lord, How Long?",,No,
How Majestic is Your Name,30,No,
How Majestic is Thy Name,,No,
How Sweet and Aweful is the Place,,No,D
Hymn for the Persecuted Church,,No,
"I Am His, and He is Mine",490,No,
I Am Resolved,391,Yes,Bb
"I Am Thine, o Lord",358,No,
I Am With You,,No,C
I Am Your Salvation,,No,Bb
I Asked the Lord That I Might Grow,,No,
"I Come by the Blood, I Come by the Cross",,No,
I Have a Shelter,,No,
I Have Decided to Follow Jesus,376,No,C
I Know Whom I Have Believed,409,No,D
"I Love You, Lord",80,No,
"I Love thy Kingdom, Lord",280,No,F
I Love to Tell the Story,297,No,
I Must Tell Jesus,430,No,
I Need Jesus,235,No,Eb
I Need Thee Every Hour,428,No,G
I Plead for Grace,,No,
I Shall Know Him,573,Yes,G
I Sing the Mighty Power of God,59,No,Bb
I Surrender,366,No,D
I Thank the Lord for You,,No,
I Want a Principle Within,,No,
I Want to Know You,,No,
I Will Call Upon the Lord,38,No,
I Will Glory in my Redeemer,,No,
I Will Praise Him,525,No,
I Will Rise,,No,
I Will Serve Thee,446,No,
I Will Sing of My Redeemer,506,No,Ab
I Will Sing of the Mercies,457,No,D
I Will Sing the Wondrous Story,508,No,D
I Would be Like Jesus,,No,
I'd Rather Have Jesus,517,No,Db
I'll Fly Away by,,No,
I'll Tell the World That I'm a Christian,300,No,
If Christ Had Not Been Raised From Death,,No,
If God is on Our Side,152,No,
If That Isn't Love,,No,
If You Would be Great,206,No,
"If You're 27 Like Me: 2, Weeks",236,No,
If my People's Hearts Are Humbled,574,No,
"Immanuel, Immanuel",102,No,
"Immortal, Invisible",25,No,Ab
Immovable Our Hope Remains,,No,
In Christ Alone,,No,Eb
In His Time,465,No,D
In Simple Response to You,,No,
In Times Like These,452,No,Ab
In Your Spirit,,No,
In my Heart There Rings a Melody,514,No,
"In my Life Lord, be Glorified",394,No,D
In the Sweet by and by,,No,
Is Your All on the Altar,,No,F
It Came Upon the Midnight Clear,128,No,Bb
It Took a Miracle,524,No,G
It is Well With my Soul,493,No,C
It's Just Like His Great Love,372,No,Bb
It's Your Grace,,No,
Jesus Bids Us Shine,489,No,
Jesus Loves Even Me,357,No,G
Jesus Loves Me,579,No,C
Jesus Messiah,,No,
Jesus Paid It All,210,No,Db
Jesus Saves,306,No,
Jesus Shall Reign,231,No,
"Jesus, What a Friend for Sinners",,No,
Jesus is All the World to Me,510,No,
Jesus is Coming Again,239,No,Bb
Jesus is Coming Soon,,No,Eb
Jesus is Lord of All,359,No,
Jesus is Lord of Everything,,No,Bb
Jesus is the Sweetest Name I Know,,No,
"Jesus, Full of Truth and Grace",,No,
"Jesus, I Am Resting, Resting",503,No,
"Jesus, Name Above All Names",112,No,Eb
"Jesus, Strong and Kind",,No,
"Jesus, Thank You",,No,
"Jesus, Your Mercy",,No,
"Jesus, the Name High Over",,No,
"Jesus, the Very Thought of Thee",,No,
"Jesus, thy Blood and Righteousness",193,No,
Join All the Glorious Names,111,No,
Joy in Serving Jesus,263,No,Ab
Joy to the World,125,No,D
"Joyful, Joyful We Adore Thee",,No,
Judge of the Secrets,,No,
Just Over in the Glory Land,,No,
Just a Closer Walk With Thee,380,No,Bb
Just as I Am,342,No,
King of Love,,No,
Lamb of Glory,197,No,G
Lamb of God,,No,C
"Lavish Love, Abundant Beauty",,No,
Lay Aside Your Passing Pleasures,,No,
Lead Me to Calvary,176,No,
"Lead On, O King Eternal",483,No,Db
Let Mercy Shine,,No,
Let There be Light,,No,
Let Your Heart be Broken,315,No,
Let the Lower Lights be Burning,438,No,Bb
Let's Just Praise the Lord,107,No,
Like a River Glorious,494,No,F
Listen to His Voice,,No,
Living for Jesus,372,No,F
"Lo, What a Cloud of Witnesses",,No,
"Lord Jesus, Living Presence",,No,
Lord Speak to Me That I May Speak,450,No,
Lord of Creation,,No,
"Lord, I Need You",430,Yes,Eb
"Lord, Keep Us Steadfast in Your Word",,No,
"Lord, Life Becomes More Simple",,No,
"Lord, May Our Thoughts",,No,
"Lord, Speak to Me",450,No,
"Lord, You Are Love",,No,
"Love Divine, All Loves Excelling",92,No,Bb
Love Theme,,No,
"Love of God, Possess Me",216,No,
Majesty,74,No,Bb
Make Me a Blessing,452,No,
Make Us One,,No,C
Make my Life a Holy Fragrance,,No,
Man of Sorrows,,No,
Mary's Song,,No,
"Mary, Did You Know?",,No,
Mary's Song,,No,
May Jesus Christ be Praised,87,No,
May the Mind of Christ my Savior,390,No,Eb
"May the Mind of Christ, my Savior",390,No,Eb
Meekness,,No,
Mercies Anew,,No,
Mercy,,No,
Moment by Moment,,No,
More About Jesus,389,No,
More Love to Thee,363,No,
Morning Has Broken,,No,
My Anchor Holds,286,No,
My Country 'Tis of Thee,571,No,F
My Faith Has Found a Resting Place,405,No,
My Faith Looks up to Thee,410,No,D
My Father Planned It All,108,Yes,
My God is All I Need / my God is so Big,,No,
My Heart is Filled With Thankfulness,,No,
My Hope is in the Lord,406,No,
"My Jesus, I Love Thee",364,No,F
"My Lord, I Did Not Choose You",,No,
My Savior's Love,512,No,Ab
My Tribute,11,No,
Nature With Open Volume Stands,,No,
Near the Cross,385,No,
Near to the Heart of God,497,No,Db
No King but Christ,,No,
No One Ever Cared for Me Like Jesus,528,No,
Noel,,No,
None but Jesus,,No,
Nothing Between,428,Yes,G
Nothing but the Blood,195,No,
Now I Belong to Jesus,511,No,
Now Unto Us a Child is Born,,No,
O Bless the God of Israel,,No,
"O Church, Arise",,No,D
"O Come, All Ye Faithful",145,No,G
"O Come, All You Unfaithful",,No,
"O Come, O Come, Emmanuel",123,No,D
O Glorious Day,,No,C
"O God, Our Help in Ages Past",52,No,
O Great God,,No,
O Happy Day,532,No,
O Holy Night,148,No,C
O How He Loves You and Me,513,No,Ab
O Jesus I Have Promised,369,No,
O Little Town of Bethlehem,141,No,F
"O Lord, my Rock and my Redeemer",,No,
"O Sacred Head, Now Wounded",178,No,
O That Will be Glory,539,No,
O Worship the King,10,No,Ab
O for a Heart to Praise my God,,No,
O for a Thousand Tongues to Sing,76,No,Ab
"O the Deep, Deep Love",,No,
O to be Like Thee,,No,
"O, Come, Let Us Adore Him",,No,
"O, How I Love Jesus",529,No,
"O, Love That Will Not Let Me Go",374,No,
"O, for a Thousand Tongues to Sing",76,No,
Obedience,,No,
Oh How He Loves You and Me,513,No,
"Oh the Deep, Deep Love",,No,Db
"Oh, What an Amazing Mystery",,No,
On That Day,,No,
Once Upon,,No,
One Day,170,No,C
One Step at a Time,,No,
One Still Night,,No,
Only One Life,378,No,
Only Trust Him,330,No,
Only a Sinner,511,No,C
"Onward, Christian Soldiers",479,No,Eb
"Open Our Eyes, Lord",383,No,D
"Open my Eyes, That I May See",381,No,Ab
Open the Eyes of my Heart,,No,
Our Father's Burning Heart,,No,
Our God Came to Visit,,No,
Our God Reigns,229,No,
Our Great Savior,89,No,
Our Hope is All in You,,No,
Overcome,,No,
Pass It on,309,No,D
Pass the Peace of Christ,,No,
Peace,,No,
Peace in Christ,,No,
Pentecost Hymn,25,No,Ab
Praise Him! Praise Him!,106,No,G
"Praise the Lord! Ye Heavens, Adore Him",9,No,Eb
Praise the Savior,75,No,
"Praise the Savior, Ye Who Know Him",75,No,
"Praise to the Lord, the Almighty",,No,
"Praise, my Soul, the King of Heaven",,No,
Precious Children,,No,
Present Lord,,No,
Raised From Death to Love and Living,,No,
Reconciled in Christ,,No,G
Redeemed,521,No,Ab
"Redeemed, How I Love to Proclaim It",521,No,
Reformation Hymn,,No,
Rejoice in His Coming,283,No,
Rejoice in the Lord,,No,
Rejoice in the Lord Always,,No,
"Rejoice, Ye Pure in Heart",562,No,
"Rejoice, the Lord is King",228,No,
Remember Your Lord,291,No,
Rescue the Perishing,299,No,
Revelation Song,,No,
Revive Us Again,295,No,F
Riches of Salvation,,No,
"Rise Up, o Church of God",293,No,
Risen From Eternal Death,,No,
Rock of Ages,204,No,Bb
Sanctuary,,No,F
Satisfied,531,No,Eb
Saved by Grace,474,No,
Saved by the Blood,182,No,Eb
Saved! Saved!,530,No,Ab
"Savior, Like a Shepherd Lead Us",462,No,Db
"Search Me, o God",438,No,
See All That Human Can be,,No,
See the Seed of Faith,189,No,Eb
Seek Ye First,,No,C
Send the Light,307,No,
Set my Soul Afire,294,No,
Shelter in the Time of Storm,353,No,
Shepherd of Love,464,No,
Shout to the Lord,,No,Bb
"Silent Night, Holy Night",147,No,Bb
Simply God,,No,
Since I Have Been Redeemed,339,No,
Since Jesus Came Into my Heart,515,No,Ab
"Soldiers of Christ, Arise",478,No,Eb
Some Golden Daybreak,284,Yes,
Sooner Count the Stars,,No,
"Speak, Lord, in the Stillness",,No,
"Spirit of God, Descend Upon my Heart",249,No,
Spirit of the Living God,247,No,F
"Stand Up, Stand up for Jesus",477,No,Bb
Stand up and Bless the Lord,21,No,
Standing on the Promises,271,No,Bb
Star Hymn,,No,
Step by Step,,No,
"Still, my Soul, be Still",,No,
"Stricken, Smitten, and Afflicted",,No,
Surely Goodness and Mercy,45,No,Eb
Sweet Hour of Prayer,433,No,
Sweeter as the Years Go by,253,No,
Take Time to be Holy,441,No,F
Take my Life and Let It be,379,No,F
"Teach Me thy Way, o Lord",,No,
Tell Me the Story of Jesus,172,No,
"Thank You, Jesus",641,No,F
"Thank You, Lord",622,No,
That Beautiful Name,,No,
The Allness of God,,No,
The Battle Belongs to the Lord,485,No,
The Battle is the Lord's,472,No,
The Birthday of the King,162,No,D
The Blood Will Never Lose Its Power,192,No,Ab
The Church's One Foundation,277,No,Eb
The Comforter Has Come,257,No,Bb
The Family of God,282,No,
The First Noel,136,No,D
The Five Solas,,No,
The Fullness of God's Glory,,No,
The Glories of Christ,,No,
The Glorified Christ,,No,
The God of the Impossible,,No,
The Gospel Song,,No,
The Gospel Was Promised,,No,
The Haven of Rest,,No,
The Heart of Christ,,No,
The Joy of the Lord,411,No,
The King in All His Beauty,,No,
The King is Coming,238,No,A
The Law of the Lord is Perfect,,No,
The Longer I Serve Him,518,No,Ab
The Look,,No,
The Lord Almighty Reigns,,No,
The Lord Has Come,,No,
The Love of God,67,No,
The Mercies of God,97,No,Ab
The Old Rugged Cross,186,No,
The Power of the Cross,,No,Bb
The Reason We Sing,,No,
The Reformation Hymn,,No,
The Solid Rock,404,No,F
The Trees of the Field,244,No,G
The Truth of God is Greater Far,,No,
The Unbelievable,,No,
The Unclouded Day,,No,G
The Way of the Cross Leads Home,471,No,
The Wonder of It All,65,No,Bb
The Wonderful Cross,,No,D
The Word Made Flesh,,No,
The Word of God,,No,
There Blooms a Rose in Bethlehem,,No,
There is One Gospel,,No,
There is Power in the Blood,191,No,Bb
There is a Fountain,196,No,Bb
There is a Redeemer,206,No,Eb
There's a Wideness in God's Mercy,68,No,Bb
There's Just Something About That Name,102,No,Eb
There's Room at the Cross for You,331,No,
This is Our God,,No,
This is my Father's World,58,No,Eb
This is the Day,590,No,Eb
Thou Art Worthy,73,No,Ab
Thou Didst Leave thy Throne,127,No,D
Thou Wilt Keep Him in Perfect Peace,492,No,
"Thy Hand, o God, Has Guided",,No,Bb
Thy Loving Kindness,69,No,Eb
Thy Word,,No,Eb
To Avert From Men God's Wrath,,No,
To God be the Glory,66,No,Ab
To be God's People,312,No,Eb
Today in Your Presence,,No,
Transcendent God,,No,
Transfiguration Hymn,,No,
Trinity Hymn,,No,
Trust and Obey,349,No,F
Trust in You,,No,
Trusting Jesus,355,No,
Turn Your Eyes Upon Jesus,639,No,F
Under His Wings,356,No,
Until Then,568,No,Bb
Victory in Jesus,473,No,G
"Walk by Faith, God's Guarantee",428,No,Bb
We Are Gathered for thy Blessing,258,No,
We Are God's People,283,No,
We Can Know Our God Transcendent,,No,
"We Come, O Christ, to You",117,No,C
We Gather Together,561,No,
We Have Come to Join in Worship,,No,
"We Have Come, God's Living Temple",580,No,
We Have an Anchor,,No,
We Lift the Light of Hope,,No,
We Look Behind at All You've Done,,No,
"We Need You, Holy God",467,No,
"We Praise Thee, o God, Our Redeemer",16,No,D
We Sing a Life Completed,,No,
We Thank Thee,,No,
"We Thank You, o Lord",,No,
We Will Glorify,72,No,D
We've a Story to Tell to the Nations,296,No,Eb
Were You There?,181,No,
We're Marching to Zion,555,No,
What Child is This?,137,No,D
What If It Were Today,245,No,
What a Friend We Have in Jesus,435,No,
What a Mighty God We Serve,,No,
What a Wonderful Savior,81,No,
What an Amazing Mystery,,No,
Whatever my God Ordains is Right,,No,
When I Survey the Wondrous Cross,185,No,F
When Morning Gilds the Skies,,No,
When We All Get to Heaven,542,No,
When We See Christ,,No,D
When the Roll is Called up Yonder,543,No,Ab
Whiter Than Snow,436,No,
Who Would Have Dreamed,,No,
Who is He in Yonder Stall?,168,No,Ab
Who is He?,,No,
Who is This?,,No,
Who is on the Lord's Side?,484,No,Bb
Wonderful Grace of Jesus,198,No,C
Wonderful Jesus Medley,,No,
Wonderful Words of Life,270,No,
Worship Christ the Risen King,225,No,Bb
Worthy is the Lamb,180,No,Bb
"Yesterday, Today and Tomorrow",,No,
Yet Not I but Through Christ in Me,,No,
Yield Not to Temptation,407,No,
You Are my All in All,,No,F
You Are my Fortress,82,Yes,Eb
You Grace Still Amazes Me,,No,
You Made Us Your Own,,No,
You Servants of God,,No,
You're Here,,No,
Your Grace Still Amazes Me,,No,
Your Great Name,,No,
Your Name is Matchless,,No,
Your Will be Done,,No,
